{
  "type": "tiba.receipt",
  "version": "0.1",
  "id": "receipt:01ea7dd8-f8b8-4565-b692-5b50b79f3a53",
  "mandate_id": "mandate:f95975e7-cbbf-4f9e-94e0-3a44c7c50b23",
  "mandate_hash": "sha256-xfdBQ-ieNw0c_BXoLMONyqYRvB4XBSlqg6LNULDgJEU",
  "executed_at": "2026-09-13T12:52:54.556Z",
  "input_hash": "sha256-TIH8oW0eo_7Tq5uuw3TlCFBfvUUiEzJk-Eo9YIZkLV0",
  "output_hash": "sha256-l5QbVED_9nG751ktVhKq-_Dv-bHm9jfBS-N38RSqx1Q",
  "mandate_chain": [
    {
      "type": "tiba.mandate",
      "version": "0.1",
      "id": "mandate:f95975e7-cbbf-4f9e-94e0-3a44c7c50b23",
      "issued_at": "2026-09-13T12:52:46.088Z",
      "issuer": "did:key:z6MkofGxs6YBH42CfUbu4GRvnVU7FmEsKoUFEYwFTkDGswQr",
      "subject": "did:key:z6Mkk2ydQQAw96YgeLJvZEMuekwSeVUVo823ZYcASWdVsw3L",
      "expires_at": "2026-09-13T13:52:42.950Z",
      "scope": {
        "actions": [
          {
            "protocol": "mcp",
            "action": "tools/call",
            "resource": "notes.local",
            "tool": "notes.write"
          },
          {
            "protocol": "payment",
            "action": "transfer",
            "resource": "solana:devnet",
            "tool": "transfer_checked"
          }
        ],
        "counterparties": [
          "notes.local",
          "mj9CbcE2hxDXLGeYFZ4kSCB6NeqMxwSxCie4fgjtVmY"
        ],
        "data": {
          "read": [],
          "write": [
            "demo/notes"
          ]
        }
      },
      "budget": {
        "amount": "0.001",
        "currency": "USDC",
        "per_action_max": "0.001"
      },
      "delegation": {
        "max_depth": 0
      },
      "revocation": {
        "url": "https://tiba.invalid/revocations/demo",
        "list_id": "demo",
        "authority": "did:key:z6MkofGxs6YBH42CfUbu4GRvnVU7FmEsKoUFEYwFTkDGswQr"
      },
      "escalation": {
        "mode": "notify"
      },
      "signature": {
        "alg": "Ed25519",
        "kid": "did:key:z6MkofGxs6YBH42CfUbu4GRvnVU7FmEsKoUFEYwFTkDGswQr",
        "value": "VSTYSWiDtIgDUfzIMrDVnExm3WDMW1oLk3RY2ZPc_t7dnUnZ0LJfm8P6mTPdDkXo-rWWVXqDYGKrxyxgolNkBg"
      }
    }
  ],
  "action": {
    "protocol": "mcp",
    "action": "tools/call",
    "resource": "notes.local",
    "tool": "notes.write",
    "counterparty": "notes.local",
    "data_access": {
      "read": [],
      "write": [
        "demo/notes"
      ]
    }
  },
  "result": "denied",
  "reason": "TIBA_REVOKED",
  "actor": "did:key:z6Mkk2ydQQAw96YgeLJvZEMuekwSeVUVo823ZYcASWdVsw3L",
  "signature": {
    "alg": "Ed25519",
    "kid": "did:key:z6Mkk2ydQQAw96YgeLJvZEMuekwSeVUVo823ZYcASWdVsw3L",
    "value": "uRPbE3wJwDahq2WFqnEt1GiU2Y-GU7S_xd6tL5My9qXogbrMVCJaxYPp4kJ-hOWeHqXqz54A-9_yEBC3c46sBw"
  }
}
